O -GlcNAc transferase inhibits visceral fat lipolysis and promotes diet-induced obesity,PMC6954210,PMC6954210.nxml,[['inducible deletion of adipose OGT', 'causes', 'rapid visceral fat loss']]
Coxiella burnetii  Type 4B Secretion System-dependent manipulation of endolysosomal maturation is required for bacterial growth,PMC6953889,PMC6953889.nxml,[['Coxiella burnetii </italic>', 'causes', 'Q fever']]
Isolation of haloalkaliphilic fungi from Lake Magadi in Kenya,PMC6953635,PMC6953635.nxml,[['cultivation strategies', 'lead to', 'recovery of more phylotypes']]
Elevated Intraocular Pressure Causes Abnormal Reactivity of Mouse Retinal Arterioles,PMC6954472,PMC6954472.nxml,[['elevated intraocular pressure ( IOP )', 'causes', 'vascular dysfunction']]
Negative cooperativity between Gemin2 and RNA provides insights into RNA selection and the SMN complex's release in snRNP assembly,PMC6954390,PMC6954390.nxml,[['SMN deficiency', 'causes', 'neurodegenerative disease spinal muscular atrophy ( SMA )']]
Does intensive goose grazing affect breeding waders?,PMC6953592,PMC6953592.nxml,[['goose grazing', 'lead to', 'shorter grass sward']]
Moderating Role of Demographic Characteristics in Breast Cancer Awareness and the Behavioural Disposition of Women in Ogun State, Nigeria,PMC6953945,PMC6953945.nxml,[['breast cancer', 'causes', 'deaths']]
